{
  "contract_version": "inspr.routing/0.1-draft",
  "evaluated_at": "2026-09-07T12:00:00Z",
  "authority_disclaimer": "Schema validity is not live proxy proof, SSO proof, or runtime authentication. Each app remains its own authority and OIDC client verifier.",
  "public_origin": {
    "scheme": "https",
    "host": "suite.fixture.test"
  },
  "landing": {
    "kind": "aithema_workspace"
  },
  "apps": {
    "aithema": {
      "enabled": true,
      "public_base_path": "",
      "oidc": {
        "client_ref": "aithema:zitadel:client:root",
        "redirect_path": "/oidc/callback",
        "post_logout_path": "/logout"
      },
      "deep_link_paths": ["/projects/demo/flow-intents"]
    },
    "paimos": {
      "enabled": true,
      "public_base_path": "/paimos",
      "oidc": {
        "client_ref": "paimos:zitadel:client:root-peer",
        "redirect_path": "/api/auth/oidc/callback"
      },
      "deep_link_paths": ["/projects/demo/baseline-batches/flow-state"]
    },
    "pharos": {
      "enabled": true,
      "public_base_path": "/pharos",
      "oidc": {
        "client_ref": "pharos:zitadel:client:root-peer",
        "redirect_path": "/auth/callback"
      }
    },
    "janus": {
      "enabled": false,
      "public_base_path": "",
      "oidc": {
        "client_ref": "janus:zitadel:client:root-peer",
        "redirect_path": "/oidc/callback"
      },
      "disconnected": {
        "external_origin": {
          "scheme": "https",
          "host": "janus.fixture.test"
        }
      }
    }
  },
  "edge": {
    "mode": "prefix_preserving_proxy",
    "trust": {
      "html_response_rewrite": false,
      "iframe_gateway": false,
      "permissive_cors": false,
      "forwarded_identity_trust": false,
      "shared_session_fallback": false
    }
  }
}
